<?xml version="1.0"?>
<!-- This file is excerpted from "XML Query Use Cases" (http://www.w3.org/TR/xquery-use-cases/)
Copyright (c) 2007 W3C (R) (MIT, ERCIM, Keio).  All Rights Reserved.  W3C liability, trademark and document use rules apply. 
The Status section of "XML Query Use Cases" states as follows:
Status of this Document
This section describes the status of this document at the time of its publication. Other documents may supersede this document. A list of current W3C publications and the latest revision of this technical report can be found in the W3C technical reports index at http://www.w3.org/TR/.
This is the W3C Working Group Note of "XML Query (XQuery) Use Cases", produced by the W3C XML Query Working Group, part of the XML Activity. This document is being published as a Working Group Note to persistently record the Use Cases that guided the development of XQuery 1.0: An XML Query Language and its associated specifications as W3C Recommendations.
Please submit comments about this document using W3C's public Bugzilla system (instructions can be found at http://www.w3.org/XML/2005/04/qt-bugzilla). If access to that system is not feasible, you may send your comments to the W3C XSLT/XPath/XQuery public comments mailing list, public-qt-comments@w3.org. It will be very helpful if you include the string [XQRecUseCases] in the subject line of your report, whether made in Bugzilla or in email. Each Bugzilla entry and email message should contain only one comment. Archives of the comments and responses are available at http://lists.w3.org/Archives/Public/public-qt-comments/.
Publication as a Working Group Note does not imply endorsement by the W3C Membership. At the time of publication, work on this document was considered complete and no further revisions are anticipated. It is a stable document and may be used as reference material or cited from another document. However, this document may be updated, replaced, or made obsolete by other documents at any time.
This document was produced by a group operating under the 5 February 2004 W3C Patent Policy. W3C maintains a public list of any patent disclosures made in connection with the deliverables of the group; that page also includes instructions for disclosing a patent. An individual who has actual knowledge of a patent which the individual believes contains Essential Claim(s) must disclose the information in accordance with section 6 of the W3C Patent Policy .
-->
<!DOCTYPE book SYSTEM "book.dtd">
<book>
  <title>Data on the Web</title>
  <author>Serge Abiteboul</author>
  <author>Peter Buneman</author>
  <author>Dan Suciu</author>
  <section id="intro" difficulty="easy" >
    <title>Introduction</title>
    <p>Text ... </p>
    <section>
      <title>Audience</title>
      <p>Text ... </p>
    </section>
    <section>
      <title>Web Data and the Two Cultures</title>
      <p>Text ... </p>
      <figure height="400" width="400">
        <title>Traditional client/server architecture</title>
        <image source="csarch.gif"/>
      </figure>
      <p>Text ... </p>
    </section>
  </section>
  <section id="syntax" difficulty="medium" >
    <title>A Syntax For Data</title>
    <p>Text ... </p>
    <figure height="200" width="500">
      <title>Graph representations of structures</title>
      <image source="graphs.gif"/>
    </figure>
    <p>Text ... </p>
    <section>
      <title>Base Types</title>
      <p>Text ... </p>
    </section>
    <section>
      <title>Representing Relational Databases</title>
      <p>Text ... </p>
      <figure height="250" width="400">
        <title>Examples of Relations</title>
        <image source="relations.gif"/>
      </figure>
    </section>
    <section>
      <title>Representing Object Databases</title>
      <p>Text ... </p>
    </section>       
  </section>
</book> 
